{
  "app_version": "0.11.6",
  "proof_id": "env-password-rotation-2026-07-14",
  "proof_type": "infra",
  "feature": "stack-scripts",
  "summary": "seed_password_rotation.py --no-admin-rotate; verified admin passwords unchanged, service passwords rotated, non-password vars unchanged.",
  "status": "passed",
  "executed_at_utc": "2026-07-14T12:00:03+00:00",
  "command": "seed_password_rotation.py --no-admin-rotate; verify admin unchanged, service rotated",
  "raw_evidence_directory": "test-results/evidence/0.11.5/infra/20260714T120003Z-env-password-rotation",
  "test_files": [
    "scripts/seeding/seed_password_rotation.py"
  ],
  "test_file_count": 1,
  "test_count": 6,
  "assertions": [
    "Admin passwords are preserved when --no-admin-rotate is used",
    "Service passwords are rotated in a --no-admin-rotate run",
    "Non-password environment variables remain unchanged"
  ]
}