{
  "app_version": "0.11.5",
  "proof_id": "secrets-reuse-admin-2026-07-14",
  "proof_type": "infra",
  "feature": "stack-scripts",
  "summary": "generate_secrets.sh --force then --force --reuse-admin; verified admin passwords reused, service passwords rotated.",
  "status": "passed",
  "executed_at_utc": "2026-07-14T12:00:02+00:00",
  "command": "generate_secrets.sh --force then --force --reuse-admin; verify admin reused, service rotated",
  "raw_evidence_directory": "test-results/evidence/0.11.5/infra/20260714T120002Z-secrets-reuse-admin",
  "test_files": [
    "scripts/supporting/generate_secrets.sh"
  ],
  "test_file_count": 1,
  "test_count": 3,
  "assertions": [
    "Admin passwords are preserved after --reuse-admin rotation",
    "Service passwords are rotated in a --reuse-admin run",
    "Non-admin variables remain unchanged across rotations"
  ]
}