{
  "app_version": "0.11.4",
  "proof_id": "spark-expectations-real-aistor",
  "proof_type": "api",
  "feature": "spark-expectations-real-aistor",
  "summary": "The Spark Expectations real-data validation against AIStor-backed parquet passed end to end in the latest 0.11.4 run.",
  "status": "passed",
  "executed_at_utc": "2026-06-27T20:39:41Z",
  "command": "bash scripts/validation/validate_spark_expectations_real_aistor.sh",
  "raw_evidence_directory": "test-results/evidence/0.11.4/api/20260627T203941Z-spark-expectations-real-aistor",
  "test_files": [
    "dq-engine/tests/test_spark_expectations_real_aistor_validation.py"
  ],
  "test_file_count": 1,
  "test_count": 25,
  "assertions": [
    "The Spark Expectations adapter lowers supported constructs correctly",
    "The real AIStor parquet validation run succeeds end to end",
    "The latest 0.11.4 validation completes with passing assertions"
  ],
  "proof_data": {
    "verification_command": "bash scripts/validation/validate_spark_expectations_real_aistor.sh",
    "verification_result": "25 passed in 9.20s"
  }
}
