{
  "app_version": "0.11.3",
  "proof_id": "ws8-a01-data-catalog-history-2026-06-05",
  "proof_type": "api",
  "feature": "WS8-A01",
  "summary": "The data-catalog API now persists immutable natural-language draft request history and exposes a dedicated audit-history endpoint. The internal API contract registry recognizes the new route, and the endpoint returns the request's append-only audit trail in canonical snake_case JSON.",
  "status": "passed",
  "executed_at_utc": "2026-06-05T21:39:22Z",
  "command": "cd /Users/jacbeekers/gitrepos/dq-rulebuilder/dq-api/fastapi && APP_CONFIG_ENCRYPTION_KEY='ksYUPwhhthla8CFag5CLNRqEYhwPIOHKkxfEgkVn9zk=' PYTHONPATH=/Users/jacbeekers/gitrepos/dq-rulebuilder/dq-utils/src:/Users/jacbeekers/gitrepos/dq-rulebuilder/dq-domain-validation/src /Users/jacbeekers/gitrepos/dq-rulebuilder/scripts/python_arm64.sh --python-bin /Users/jacbeekers/gitrepos/dq-rulebuilder/venv/bin/python -m pytest -o addopts='' tests/api/test_data_catalog_endpoints.py -q",
  "raw_evidence_directory": "test-results/evidence/0.11.2/command/20260605T213922Z-ws8-a01-data-catalog-history",
  "test_files": [
    "tests/api/test_data_catalog_endpoints.py"
  ],
  "test_file_count": 1,
  "test_count": 33,
  "assertions": [
    "The new GET /api/data-catalog/v1/data-definition-tasks/requests/{request_id}/history endpoint returned 200 for an existing request and exposed the append-only request trail.",
    "The internal API contract registry resolved the new history route after the aggregate bundle was updated.",
    "The full data-catalog API regression file still passed after the contract and repository changes."
  ],
  "proof_data": {
    "endpoint_status": 200,
    "registry_lookup": "resolved",
    "tests_passed": 33,
    "warnings": 2
  }
}