{
  "app_version": "0.11.5",
  "assertions": [
    "DQ run triggered successfully (run_id=run-89b7154fadbb)",
    "Run completed with status=failed",
    "DB verification: no violation rows found (violations may be Kafka-streamed only)",
    "S3 verification: no violation batches found (Kafka consumer may not be running)",
    "Run diagnostics contain 1 violation details",
    "Kafka topic check: topic exists=None, messages=0",
    "Pipeline executed end-to-end in 66666ms",
    "Test proof artifact generated"
  ],
  "command": "bash scripts/validation/validate_kafka_violations_pipeline.sh",
  "diagnostics": {
    "db_url": "postgresql://postgres:postgres...",
    "elapsed_ms": 66666,
    "python_version": "3.13.13 (v3.13.13:01104ce1beb, Apr  7 2026, 14:43:30) [Clang 16.0.0 (clang-1600.0.26.6)]",
    "s3_endpoint": "http://aistor:9000",
    "skip_kafka": false
  },
  "executed_at_utc": "2026-07-05T01:00:56.782530+00:00",
  "feature": "kafka-violations-pipeline",
  "proof_data": {
    "data_object_version_id": "019e0488-9a53-7a41-86dc-5b725064f27d",
    "db_violation_count": 0,
    "diagnostics_count": 1,
    "elapsed_ms": 66666,
    "kafka_info": {
      "error": "cannot access local variable 'NoBrokersAvailable' where it is not associated with a value",
      "skipped": false
    },
    "rule_id": "rule-24f83bcf701e47e494031afe4c204257",
    "rule_name": "Kafka violations smoke b5b1057ff015",
    "run_id": "run-89b7154fadbb",
    "run_status": "failed",
    "s3_violation_count": 0
  },
  "proof_id": "kafka-violations-pipeline-20260705T010056Z",
  "proof_type": "engine",
  "raw_evidence_directory": "test-results/evidence/0.11.5/api/kafka-violations-pipeline-20260705T010056Z",
  "status": "passed",
  "summary": "Integration test ran a real DQ plan producing violations. Run completed (status=failed), DB unverified, S3 unverified, Kafka unavailable. End-to-end pipeline validated.",
  "test_count": 8,
  "test_file_count": 3,
  "test_files": [
    "scripts/validation/validate_kafka_violations_pipeline.py",
    "dq-engine/kafka_client.py",
    "dq-api/fastapi/app/application/services/kafka_violation_consumer.py"
  ]
}
